{
  "id": "network.dns.resolver",
  "version": "1",
  "title": "Stub resolver and /etc/resolv.conf",
  "summary": "The stub resolver is the part of the C library that turns a name into DNS queries. It does not know any answers itself: it sends each query to the nameservers listed in `/etc/resolv.conf` and returns what they say.",
  "aliases": [
    "resolver",
    "stub resolver",
    "nameserver",
    "resolv.conf",
    "/etc/resolv.conf",
    "search domain",
    "ndots"
  ],
  "skills": [
    "network.dns.resolution"
  ],
  "sections": [
    {
      "kind": "what",
      "body": "A small client inside libc (`getaddrinfo`). Its configuration file `/etc/resolv.conf` lists up to three `nameserver` addresses, optional `search` domains and `options` such as `timeout:` and `attempts:`."
    },
    {
      "kind": "why",
      "body": "Applications should not implement DNS. Centralizing the choice of server in one file lets an administrator (or Docker, systemd-resolved, DHCP) change where every program on the host sends its queries."
    },
    {
      "kind": "mechanism",
      "body": "On a lookup the resolver builds a DNS query packet and sends it over UDP to port 53 of a configured nameserver, retrying and falling back to TCP for large answers. glibc tries the servers in order; musl (Alpine, used in this lab) queries all of them in parallel and takes the first reply. A server that does not exist produces a timeout or `network unreachable`, not an answer."
    },
    {
      "kind": "example",
      "body": "```\nnameserver 10.20.0.2\nsearch shop.example\noptions timeout:1 attempts:1\n```\nWith `search shop.example`, the short name `api` is also tried as `api.shop.example`."
    },
    {
      "kind": "observe",
      "body": "- `cat /etc/resolv.conf`: which servers are asked.\n- `dig api.shop.example`: the footer line `SERVER:` shows the server that answered; errors show the server that failed.\n- `ss -lunp`: which process listens on UDP port 53 on this host.\n- `tcpdump -ni any udp port 53`: the queries actually leaving the resolver."
    },
    {
      "kind": "failure_modes",
      "body": "- `nameserver` points at an address with no DNS server: `no servers could be reached`.\n- A DNS server that does not hold the zone and cannot recurse: `SERVFAIL` or `REFUSED`.\n- Missing `search` domain: short names fail while full names work.\n- File replaced by a container runtime or DHCP client: a fix disappears after restart."
    }
  ]
}
